{
  "$schema": "https://oss.callstack.com/react-native-brownfield/schema.json",
  "android": {
    "moduleName": "brownfieldlib",
    "variant": "release"
  },
  "ios": {
    "scheme": "BrownfieldLib",
    "configuration": "Release"
  },
  "verbose": true,
  "brownie": {
    "kotlin": "./android/brownfieldlib/src/main/java/com/callstack/rnbrownfield/demo/expoapp57/Generated/",
    "kotlinPackageName": "com.callstack.rnbrownfield.demo.expoapp57"
  }
}
